{
  "apk": {
    "name": "AegisVaultMobile-v1.5-debug.apk",
    "sha256": "3a02623f1d9b5c44e4b509190e7f95e118f17ef08d43961665934b481dab4412",
    "signingCertificateSha256": "b2b0f013dcfa428bb6f4c3563faa204c7890f72abd6062d1cbbb155222d493c9",
    "size": 21105896
  },
  "applicationId": "com.aegisvault.mobile",
  "minSdk": 26,
  "releaseTag": "v1.5",
  "schemaVersion": 1,
  "versionCode": 7,
  "versionName": "1.5"
}
